question,answer
Bagaimana pembayaran untuk mahasiswa yang berbeasiswa Bidikmisi?,"Mahasiswa berbeasiswa Bidik Misi dibebaskan melakukan pembayaran UKT/SPP , Ikoma namun tetap harus melakukan daftar ulang online"
"Saya sudah melakukan pembayaran SPP/UKT, Ikoma. Apakah sudah otomatis daftar ulang?","Tidak, Anda harus login ke laman http://online.pens.ac.id pada menu daftar ulang klik tombol DAFTAR ULANG, lalu cetak bukti daftar ulang anda sebagai bukti anda sudah melakukan daftar ulang."
Kenapa ketika mencoba membayar ONLINE melalui ATM/Internet Banking/TELLER pembayaran tidak dapat dilakukan?,Perhatikan jadwal pembayaran karena pembayaran dibuka dan ditutup sesuai kalender akademik
Berapakah jumlah harus dibayarkan untuk UKT/SPP dan IKOMA?,Karena jumlah yang dibayarkan tiap mahasiswa dan angkatan berbeda maka jumlah itu silahkan dicek di menu daftar ulang laman http://online.mis.eepis-its.edu atau ATM/Internet Banking/TELLER
Pembayaran melalui ATM bersama apakah bisa? ,Tidak Bisa
Bagaimana cara untuk mendaftar beasiswa Adaro ?,Untuk mendaftar beasiswa adaro dari PENS dapat melalui link https://intip.in/Adaro2020/
Bagaimana cara mendaftar beasiwa Djarum Plus?,Untuk mendaftar beasiswa djarum plus dapat melalui website https://djarumbeasiswaplus.org/
Beasiswa apa saja yang bekerja sama dengan PENS?,"beasiswa yang terdaftar adalah astra, PPA, pemerintah kota dan djarum beasiswa plus"
Apa itu beasiswa Djarum plus ,Program Djarum Beasiswa Plus merupakan beasiswa prestasi yang memberikan kesempatan bagi mahasiswa dari berbagai jurusan yang tengah menempuh program studi Strata 1/ Diploma 4 di perguruan tinggi negeri maupun swasta yang memiliki kerja sama (bermitra) dengan Djarum Foundation.
Apa itu kemahasiswaan PENS?,"Kemahasiswaan PENS adalah unit departemen yang bertanggung jawab mulai dari  pendaftaran dan administrasi mahasiswa, bimbingan akademis, Kegiatan ektrakurikuler, kesejahteraan mahasiswa, pengelolaan kampus serta pengembangan karir."
Dimana saya bisa menemukan Kemahasiswaan PENS ? ,Gedung Kemahasiswaan PENS berlokasi di D4 Lantai 1 di Politeknik Elektronika Negeri Surabaya
PENS berlokasi dimana?,"Jalan Raya ITS - Kampus PENS Sukolilo Surabaya 60111, Indonesia"
Apa Persyaratan pendaftaran beasiswa Djarum beasiswaplus,"Persyaratan pendaftaran adalah:
Sedang menempuh pendidikan Strata 1/Diploma 4 di semester IV, dari semua disiplin ilmu.
IPK minimum 3.00 pada semester III, serta dapat mempertahankan IPK minimum 3.00 hingga akhir semester IV.
Aktif mengikuti kegiatan organisasi baik di dalam maupun luar kampus.
Tidak sedang menerima beasiswa dari pihak lain.
Kuliah di mitra Perguruan Tinggi Program Djarum Beasiswa Plus.
"
Bagaimana Alur pendaftaran Djarum Beasiswa Plus,"Pendaftar melakukan pendaftaran online dan mengisi dengan lengkap formulir pendaftaran (melalui link website resmi yang akan dibuka pada bulan 20 Maret - 27 Mei 2023).
Pendaftar akan mendapatkan email konfirmasi pendaftaran segera setelah mengisi secara lengkap formulir pendaftaran online.
Pendaftar mengirimkan berkas administrasi ke panitia seleksi ke alamat yang tertera pada email konfirmasi pendaftaran online.
Pendaftar yang berkasnya lolos seleksi administrasi akan menerima undangan tes tulis dari Djarum Beasiswa Plus melalui email dan SMS.
Tes tulis diselenggarakan secara daring.
Pendaftar yang lolos tes tulis akan diundang untuk wawancara.
Pengumuman Djarum Beasiswa Plus dapat diakses di website resmi djarumbeasiswaplus.org diikuti dengan pengumuman di Bagian Kemahasiswaan di kampus."
Kapan Pendaftaran Beasiswa Djarum beasiswa Plus dibuka?,"Program Djarum Beasiswa Plus dibuka 1 kali dalam 1 tahun untuk mahasiswa yang tengah menempuh semester IV. Untuk tahun 2023, pendaftaran akan dibuka pada 20 Maret 2023 dan ditutup pada 27 Mei 2023. Pantau updatenya di akun resmi kami."
Kegiatan penalaran apa saja yang ada di PENS?,"Kegiatan mahasiswa PENS yang meliputi penalaran adalah GEMASTIK, NPEO, PKM dan MAWAPRES"
Kegiatan UKM apa saja yang ada di PENS?,"Futsal, Volly , Tari, Tenis Meja, Badminton, Tae Kwon Do, Basket dan ENT"
Organisasi Mahasiswa apa saja yang ada di PENS?,"Badan Eksekutif Mahasiswa, Dewan Perwakilan Mahasiswa, Dewan Konstitusi Mahasiswa, Lembaga Minat Bakat, Unit Kegiatan Kerohanian Islam, Unit Kegiatan Kristen Katolik dan Himpunan Mahasiswa"
Apa saja kemahasiswaan PENS di bidang Kesejahteraan ?,"Mulai dari beasiswa, Konsultasi Psikologi dan Klinik untuk dokter umum."
